{
  "ticket_id": "t-messy-002",
  "type": "nurture",
  "subject": "An update from Northwind Studio",
  "preheader": "Details inside.",
  "from_name": "Northwind Studio",
  "from_email": "hello@northwindstudio.example",
  "blocks": [
    {
      "kind": "hero",
      "text": "An update from Northwind Studio",
      "html": "<h1 style=\"font-size:24px;line-height:32px;margin:0;\">An update from Northwind Studio</h1>"
    },
    {
      "kind": "body",
      "text": "{% if customer.first_name %}Hi {{ customer.first_name }},{% else %}Hi there,{% endif %}",
      "html": "<p style=\"font-size:15px;line-height:24px;\">{% if customer.first_name %}Hi {{ customer.first_name }},{% else %}Hi there,{% endif %}</p>"
    },
    {
      "kind": "footer",
      "text": "Northwind Studio, 100 Harbor Way, Suite 400, Oakland, CA 94607 You are receiving this because you have a Northwind Studio account. Unsubscribe",
      "html": "<!-- Locked footer chrome. Attached by application code (attachFooter), never\n     emitted by the model. Contains the unsubscribe link and postal address\n     that CAN_UNSUB / CAN_ADDRESS check for. -->\n<table role=\"presentation\" width=\"100%\" cellpadding=\"0\" cellspacing=\"0\" style=\"border-top:1px solid #e5e5e5;margin-top:32px;\">\n  <tr>\n    <td style=\"padding:24px 0;font-family:Helvetica,Arial,sans-serif;font-size:12px;line-height:18px;color:#6b7280;\">\n      Northwind Studio, 100 Harbor Way, Suite 400, Oakland, CA 94607<br>\n      You are receiving this because you have a Northwind Studio account.<br>\n      <a href=\"https://www.northwindstudio.example/unsubscribe\" style=\"color:#6b7280;text-decoration:underline;\">Unsubscribe</a>\n    </td>\n  </tr>\n</table>\n"
    }
  ],
  "cta": {
    "label": "",
    "href": "",
    "role": "primary"
  },
  "needs_input": [
    "missing goal: ask the requester",
    "missing offer: ask the requester",
    "missing cta: ask the requester",
    "missing cta link: ask the requester",
    "deadline is relative ('next week'), so ask for a date",
    "uncleared claim \"50% faster\" is not in the approved claims library. Get it approved or drop it."
  ],
  "citations": [],
  "lint": {
    "status": "fail",
    "violations": [
      {
        "rule_id": "CTA_COUNT",
        "severity": "block",
        "policy_class": "synthetic_poc_policy",
        "message": "expected exactly one cta block, found 0"
      },
      {
        "rule_id": "CTA_DOMAIN",
        "severity": "block",
        "policy_class": "synthetic_poc_policy",
        "message": "cta is not a valid URL: ",
        "span": ""
      }
    ]
  }
}
